{
  "$schema": "http://json-schema.org/draft-07/schema#",
  "$id": "https://zavx0z.github.io/node/schema.json#",
  "definitions": {
    "schemaArray": {
      "type": "array",
      "minItems": 1,
      "items": { "$ref": "#/definitions/props" }
    },
    "nonNegativeInteger": {
      "type": "integer",
      "minimum": 0
    },
    "nonNegativeIntegerDefault0": {
      "allOf": [{ "$ref": "#/definitions/nonNegativeInteger" }, { "default": 0 }]
    },
    "simpleTypes": {
      "enum": ["array", "boolean", "integer", "null", "number", "object", "string"]
    },
    "stringArray": {
      "type": "array",
      "items": { "type": "string" },
      "uniqueItems": true,
      "default": []
    },
    "localizedString": {
      "anyOf": [
        {
          "type": "string"
        },
        {
          "type": "object",
          "minProperties": 1,
          "propertyNames": {
            "pattern": "^[a-z]{2}(-[A-Z]{2})?$"
          },
          "additionalProperties": {
            "type": "string"
          }
        }
      ]
    },
    "props": {
      "type": "object",
      "properties": {
        "title": {
          "$ref": "#/definitions/localizedString"
        },
        "type": {
          "anyOf": [
            { "$ref": "#/definitions/simpleTypes" },
            {
              "type": "array",
              "items": { "$ref": "#/definitions/simpleTypes" },
              "minItems": 1,
              "uniqueItems": true
            },
            {
              "file": {
                "type": "string",
                "contentMediaType": "application/octet-stream",
                "contentEncoding": "base64"
              }
            }
          ]
        },
        "description": {
          "$ref": "#/definitions/localizedString"
        },
        "examples": {
          "type": "array",
          "items": true
        },
        "pattern": {
          "type": "string",
          "format": "regex"
        }
      },
      "additionalProperties": false
    },
    "params": {
      "type": "object",
      "propertyNames": { "format": "regex" },
      "additionalProperties": {
        "$ref": "#/definitions/props"
      },
      "default": {}
    }
  },
  "properties": {
    "title": {
      "title": "Node Title",
      "$ref": "#/definitions/localizedString"
    },
    "description": {
      "title": "Node description",
      "$ref": "#/definitions/localizedString"
    },
    "preview": {
      "title": "Preview result",
      "type": "boolean"
    },
    "input": {
      "title": "Node input parameters",
      "$ref": "#/definitions/params"
    },
    "output": {
      "title": "Node output parameters",
      "$ref": "#/definitions/params"
    },
    "$schema": {
      "type": "string",
      "format": "uri"
    },
    "position": {
      "type": "object",
      "properties": {
        "x": { "type": "number" },
        "y": { "type": "number" }
      },
      "required": ["x", "y"],
      "additionalProperties": false
    },
    "size": {
      "type": "object",
      "properties": {
        "width": { "type": "number", "minimum": 0 },
        "height": { "type": "number", "minimum": 0 }
      },
      "required": ["width"],
      "additionalProperties": false
    }
  },
  "additionalProperties": false,
  "required": ["$schema", "title"]
}
