{
  "$schema": "file:///c:/projects/node/schema.json",
  "title": {
    "en": "Image",
    "ru": "Изображение"
  },
  "description": "Default description without localization",
  "input": {
    "fileImg": {
      "type": "file",
      "title": {
        "ru": "Открыть изображение",
        "en": "Open image"
      },
      "description": {
        "en": "Description with localization",
        "ru": "Описание с локализацией"
      },
      "examples": ["c:\\images\\image.png"],
      "pattern": "^.*\\.(jpg|jpeg|png)$"
    }
  },
  "output": {
    "base64": {
      "type": "string",
      "title": {
        "ru": "Изображение Base64",
        "en": "Image Base64",
        "de": "Image Base64"
      },
      "description": {
        "ru": "Изображение в формате Base64",
        "en": "Image in Base64 format",
        "de": "Image in Base64 format"
      },
      "examples": ["data:image/png;base64,iVBORw0KGgoAAAANSUhEUgAAAAUAAAA"],
      "pattern": "^data:image/.*;base64,.*$"
    }
  },
  "position": {
    "x": 10,
    "y": 10
  },
  "size": {
    "width": 100
  },
  "preview": true
}
